{
  "schema": 1,
  "version": "2026.06.dev",
  "generated_at": "2026-06-22T00:00:00Z",
  "minimum_app_version": "0.1.0",
  "database_schema_version": 1,
  "sources": [
    {
      "id": "chiaki-modern-overlay",
      "name": "ChiaKey Modern Overlay Seed",
      "url": "https://github.com/chiakich/ChiaKey-Lexicon/tree/main/sources/chiaki-modern-overlay",
      "format": "tsv",
      "license": "TBD",
      "attribution": "ChiaKey Lexicon project seed data",
      "sha256": "TBD",
      "enabled": true,
      "priority": 100
    }
  ],
  "artifacts": [
    {
      "id": "smart-mandarin-db",
      "kind": "chiakey-source-db",
      "url": "https://github.com/chiakich/ChiaKey-Lexicon/releases/download/2026.06/ChiaKeySource-2026.06.db",
      "filename": "ChiaKeySource-2026.06.db",
      "sha256": "TBD",
      "size": 0,
      "database_schema_version": 1,
      "language_model_version": "2026.06"
    }
  ]
}
